{"$schema":"https://json-schema.org/draft/2020-12/schema","$id":"https://example.invalid/gd-evaluation/schemas/micro-anchor-v0.1.schema.json","title":"Micro Anchor v0.1","type":"object","additionalProperties":false,"required":["contract_version","anchor_set_version","anchor_id","rubric_id","rubric_version","target_dimension","target_score","target_participant_id","scenario_context","opportunity_description","participants","micro_episode","expected_evidence_message_ids","expected_not_evaluable_reason","rationale","boundary_note","prohibited_inference_note","author","reviewer","approval_status"],"$defs":{"dimension":{"enum":["issue_framing","logical_reasoning","listening_and_response","valuable_contribution","collaboration_and_relationship","decision_and_consensus","process_and_time_management"]},"score":{"oneOf":[{"type":"integer","minimum":1,"maximum":4},{"const":"NE"}]},"neReason":{"enum":["INSUFFICIENT_OPPORTUNITY","AI_QUALITY_FAILURE","TRANSCRIPT_INCOMPLETE","EVENT_ORDER_INVALID","SYSTEM_ERROR","SCENARIO_CONDITION_UNFAIR","SCENARIO_CONTRACT_FAILURE","INSUFFICIENT_EVIDENCE","JUDGE_FAILURE","OTHER_REVIEW_REQUIRED"]},"participant":{"type":"object","additionalProperties":false,"required":["participant_id","speaker_type","role"],"properties":{"participant_id":{"type":"string","pattern":"^[a-z][a-z0-9_]*$"},"speaker_type":{"enum":["user","ai","system"]},"role":{"type":"string","minLength":1}}},"message":{"type":"object","additionalProperties":false,"required":["message_id","sequence_index","participant_id","speaker_type","phase","move","text"],"properties":{"message_id":{"type":"string","pattern":"^m[0-9]{3}$"},"sequence_index":{"type":"integer","minimum":1,"maximum":8},"participant_id":{"type":"string","minLength":1},"speaker_type":{"enum":["user","ai","system"]},"phase":{"type":"string","minLength":1},"move":{"type":"string","minLength":1},"text":{"type":"string","minLength":1}}}},"properties":{"contract_version":{"const":"0.1"},"anchor_set_version":{"const":"micro-anchor-set-v0.1"},"anchor_id":{"type":"string","pattern":"^anchor-(if|lr|ls|vc|cr|dc|pt)-(1|2|3|4|ne)-[0-9]{3}$"},"rubric_id":{"const":"candidate-behavior"},"rubric_version":{"const":"candidate-behavior-v0.1"},"target_dimension":{"$ref":"#/$defs/dimension"},"target_score":{"$ref":"#/$defs/score"},"target_participant_id":{"type":"string","minLength":1},"scenario_context":{"type":"object","additionalProperties":false,"required":["scenario_family_id","topic","task","shared_context","constraints"],"properties":{"scenario_family_id":{"type":"string","pattern":"^anchor-family-[a-z]{2}-[0-9]{3}$"},"topic":{"type":"string","minLength":1},"task":{"type":"string","minLength":1},"shared_context":{"type":"string","minLength":1},"constraints":{"type":"array","minItems":1,"uniqueItems":true,"items":{"type":"string","minLength":1}}}},"opportunity_description":{"type":"object","additionalProperties":false,"required":["opportunity_id","status","trigger_message_ids","description"],"properties":{"opportunity_id":{"type":"string","pattern":"^ANCHOR-[A-Z]{2}-OP-[0-9]{3}$"},"status":{"enum":["sufficient","insufficient","uncertain","invalid"]},"trigger_message_ids":{"type":"array","minItems":1,"uniqueItems":true,"items":{"type":"string","pattern":"^m[0-9]{3}$"}},"description":{"type":"string","minLength":1}}},"participants":{"type":"array","minItems":2,"maxItems":6,"items":{"$ref":"#/$defs/participant"}},"micro_episode":{"type":"array","minItems":3,"maxItems":8,"items":{"$ref":"#/$defs/message"}},"expected_evidence_message_ids":{"type":"array","uniqueItems":true,"items":{"type":"string","pattern":"^m[0-9]{3}$"}},"expected_not_evaluable_reason":{"oneOf":[{"type":"null"},{"$ref":"#/$defs/neReason"}]},"rationale":{"type":"string","minLength":1},"boundary_note":{"type":"object","additionalProperties":false,"required":["adjacent_lower","adjacent_upper","score_1_vs_ne"],"properties":{"adjacent_lower":{"oneOf":[{"type":"null"},{"type":"object","additionalProperties":false,"required":["score","difference"],"properties":{"score":{"type":"integer","minimum":1,"maximum":4},"difference":{"type":"string","minLength":1}}}]},"adjacent_upper":{"oneOf":[{"type":"null"},{"type":"object","additionalProperties":false,"required":["score","difference"],"properties":{"score":{"type":"integer","minimum":1,"maximum":4},"difference":{"type":"string","minLength":1}}}]},"score_1_vs_ne":{"type":"string","minLength":1}}},"prohibited_inference_note":{"type":"string","minLength":1},"author":{"type":"string","minLength":1},"reviewer":{"oneOf":[{"type":"null"},{"type":"string","minLength":1}]},"approval_status":{"enum":["draft","content_reviewed","blind_calibration_pending","approved","rejected"]}},"allOf":[{"if":{"properties":{"target_score":{"type":"integer"}},"required":["target_score"]},"then":{"properties":{"opportunity_description":{"properties":{"status":{"const":"sufficient"}}},"expected_evidence_message_ids":{"minItems":1},"expected_not_evaluable_reason":{"type":"null"}}}},{"if":{"properties":{"target_score":{"const":4}},"required":["target_score"]},"then":{"properties":{"expected_evidence_message_ids":{"minItems":2}}}},{"if":{"properties":{"target_score":{"const":"NE"}},"required":["target_score"]},"then":{"properties":{"expected_evidence_message_ids":{"maxItems":0},"expected_not_evaluable_reason":{"$ref":"#/$defs/neReason"},"opportunity_description":{"properties":{"status":{"enum":["insufficient","uncertain","invalid"]}}}}}},{"if":{"properties":{"approval_status":{"enum":["content_reviewed","blind_calibration_pending","approved"]}},"required":["approval_status"]},"then":{"properties":{"reviewer":{"type":"string","minLength":1}}}}]}
