{"contract_version":"0.1","anchor_set_version":"micro-anchor-set-v0.1","anchor_id":"anchor-dc-3-001","rubric_id":"candidate-behavior","rubric_version":"candidate-behavior-v0.1","target_dimension":"decision_and_consensus","target_score":3,"target_participant_id":"candidate_target","scenario_context":{"scenario_family_id":"anchor-family-dc-001","topic":"新サービスの公開計画","task":"三つの公開案を比較し、反対意見と実行条件を含む合意を作る","shared_context":"即時の限定公開、一か月延期した全面公開、段階公開の三案から方針を決める。","constraints":["公開期限は六週間以内","重大不具合率は3%","サポート上限は100利用者"]},"opportunity_description":{"opportunity_id":"ANCHOR-DC-OP-001","status":"sufficient","trigger_message_ids":["m001","m004"],"description":"候補者が判断基準、反対意見、実行条件、留保を扱い、合意可能な結論を作れる場面。"},"participants":[{"participant_id":"candidate_target","speaker_type":"user","role":"evaluation_target"},{"participant_id":"participant_a","speaker_type":"user","role":"peer"},{"participant_id":"participant_b","speaker_type":"user","role":"peer"},{"participant_id":"facilitator_ai","speaker_type":"ai","role":"facilitator"}],"micro_episode":[{"message_id":"m001","sequence_index":1,"participant_id":"facilitator_ai","speaker_type":"ai","phase":"opening","move":"clarify_goal","text":"三つの公開案から方針を決めます。判断基準と合意条件を示してください。"},{"message_id":"m002","sequence_index":2,"participant_id":"participant_a","speaker_type":"user","phase":"discussion","move":"propose_idea","text":"学習を早めるため、即時の限定公開がよいと思います。"},{"message_id":"m003","sequence_index":3,"participant_id":"candidate_target","speaker_type":"user","phase":"discussion","move":"compare_options","text":"速度、リスク、学習量で比べると、100利用者の段階公開が最も均衡します。重大不具合が増えたら停止する条件を置きます。"},{"message_id":"m004","sequence_index":4,"participant_id":"participant_b","speaker_type":"user","phase":"constraint_update","move":"challenge","text":"サポートは100利用者までで、法務確認もまだ完了していません。拙速な公開には反対です。"},{"message_id":"m005","sequence_index":5,"participant_id":"candidate_target","speaker_type":"user","phase":"revision","move":"propose_decision","text":"法務確認完了を開始条件にし、二週間の試行後に不具合率と問い合わせ量で拡大か延期を決めましょう。"},{"message_id":"m006","sequence_index":6,"participant_id":"facilitator_ai","speaker_type":"ai","phase":"closing","move":"summarize","text":"結論、反対意見、実行条件を確認して終了します。"}],"expected_evidence_message_ids":["m003"],"expected_not_evaluable_reason":null,"rationale":"共通基準で三案を比較し、開始条件、停止条件、再判断方法を示して実行可能な結論を作った。","boundary_note":{"adjacent_lower":{"score":2,"difference":"複数案を共通基準で比較し、開始・停止・再判断条件へ接続した。"},"adjacent_upper":{"score":4,"difference":"反対意見を合意形成へ組み込み、担当と留保を明示するところまでは至らない。"},"score_1_vs_ne":"三案と反対意見が明示され、候補者が判断できる十分な機会がある。"},"prohibited_inference_note":"名前、性別、年齢、障害、アクセント、発言量、性格などは得点根拠に使用しない。","author":"synthetic-calibration-team","reviewer":null,"approval_status":"draft"}
