{
  "contract_version": "0.1",
  "anchor_set_version": "micro-anchor-set-v0.1",
  "anchor_id": "anchor-if-4-001",
  "rubric_id": "candidate-behavior",
  "rubric_version": "candidate-behavior-v0.1",
  "target_dimension": "issue_framing",
  "target_score": 4,
  "target_participant_id": "candidate_target",
  "scenario_context": {
    "scenario_family_id": "anchor-family-if-001",
    "topic": "地域交流施設の企画",
    "task": "限られた時間で検討論点と判断基準を整理する",
    "shared_context": "「若者に良い地域交流施設」という曖昧な依頼が提示された。",
    "constraints": [
      "予算上限は600万円",
      "対象となる若者の範囲が未定"
    ]
  },
  "opportunity_description": {
    "opportunity_id": "ANCHOR-IF-OP-001",
    "status": "sufficient",
    "trigger_message_ids": [
      "m001",
      "m004"
    ],
    "description": "候補者が目的、対象、前提、制約、判断基準を整理できる場面。"
  },
  "participants": [
    {
      "participant_id": "candidate_target",
      "speaker_type": "user",
      "role": "evaluation_target"
    },
    {
      "participant_id": "participant_a",
      "speaker_type": "user",
      "role": "peer"
    },
    {
      "participant_id": "facilitator_ai",
      "speaker_type": "ai",
      "role": "facilitator"
    }
  ],
  "micro_episode": [
    {
      "message_id": "m001",
      "sequence_index": 1,
      "participant_id": "facilitator_ai",
      "speaker_type": "ai",
      "phase": "opening",
      "move": "clarify_goal",
      "text": "「若者に良い地域交流施設」を企画します。目的、対象、制約、判断基準を整理してください。"
    },
    {
      "message_id": "m002",
      "sequence_index": 2,
      "participant_id": "participant_a",
      "speaker_type": "user",
      "phase": "discussion",
      "move": "propose_idea",
      "text": "私はカフェを併設すると人が集まりやすいと思います。"
    },
    {
      "message_id": "m003",
      "sequence_index": 3,
      "participant_id": "candidate_target",
      "speaker_type": "user",
      "phase": "discussion",
      "move": "define_scope",
      "text": "「若者」の範囲と成功条件が曖昧です。対象を高校生と大学生に分け、継続利用率と交流機会を主要基準、費用と安全性を制約として整理しましょう。"
    },
    {
      "message_id": "m004",
      "sequence_index": 4,
      "participant_id": "facilitator_ai",
      "speaker_type": "ai",
      "phase": "constraint_update",
      "move": "challenge",
      "text": "追加条件です。初年度予算は600万円までで、対象となる若者の範囲はまだ決まっていません。"
    },
    {
      "message_id": "m005",
      "sequence_index": 5,
      "participant_id": "candidate_target",
      "speaker_type": "user",
      "phase": "revision",
      "move": "prioritize",
      "text": "予算上限が出たので、優先順位を必須ニーズ、低コストで交流を生む機能、追加機能へ更新し、対象別の論点漏れも確認します。"
    },
    {
      "message_id": "m006",
      "sequence_index": 6,
      "participant_id": "facilitator_ai",
      "speaker_type": "ai",
      "phase": "closing",
      "move": "summarize",
      "text": "ここまでの整理をもとに、次の検討へ進みます。"
    }
  ],
  "expected_evidence_message_ids": [
    "m003",
    "m005"
  ],
  "expected_not_evaluable_reason": null,
  "rationale": "初期の曖昧さと論点漏れを特定し、追加条件後に優先順位を更新した。異なる時点の二つの独立証拠が議論構造を改善している。",
  "boundary_note": {
    "adjacent_lower": {
      "score": 3,
      "difference": "異なる時点で曖昧さ・論点漏れの特定と、追加条件後の優先順位更新を行い、議論構造全体を改善した。"
    },
    "adjacent_upper": null,
    "score_1_vs_ne": "十分な機会があり、二つの独立証拠で高度な行動が観察された。"
  },
  "prohibited_inference_note": "名前、性別、年齢、障害、アクセント、発言量、性格などは得点根拠に使用しない。",
  "author": "synthetic-calibration-team",
  "reviewer": null,
  "approval_status": "draft"
}
