{
  "contract_version": "0.1",
  "anchor_set_version": "micro-anchor-set-v0.1",
  "anchor_id": "anchor-if-ne-001",
  "rubric_id": "candidate-behavior",
  "rubric_version": "candidate-behavior-v0.1",
  "target_dimension": "issue_framing",
  "target_score": "NE",
  "target_participant_id": "candidate_target",
  "scenario_context": {
    "scenario_family_id": "anchor-family-if-001",
    "topic": "地域交流施設の企画",
    "task": "限られた時間で検討論点と判断基準を整理する",
    "shared_context": "「若者に良い地域交流施設」という曖昧な依頼が提示された。",
    "constraints": [
      "予算上限は600万円",
      "対象となる若者の範囲が未定"
    ]
  },
  "opportunity_description": {
    "opportunity_id": "ANCHOR-IF-OP-001",
    "status": "invalid",
    "trigger_message_ids": [
      "m001",
      "m003"
    ],
    "description": "AIが候補者の構造化前に目的、対象、判断基準を確定し、課題設定の機会を失効させた場面。"
  },
  "participants": [
    {
      "participant_id": "candidate_target",
      "speaker_type": "user",
      "role": "evaluation_target"
    },
    {
      "participant_id": "participant_a",
      "speaker_type": "user",
      "role": "peer"
    },
    {
      "participant_id": "facilitator_ai",
      "speaker_type": "ai",
      "role": "facilitator"
    }
  ],
  "micro_episode": [
    {
      "message_id": "m001",
      "sequence_index": 1,
      "participant_id": "facilitator_ai",
      "speaker_type": "ai",
      "phase": "opening",
      "move": "clarify_goal",
      "text": "「若者に良い地域交流施設」を企画します。目的、対象、制約、判断基準を整理してください。"
    },
    {
      "message_id": "m002",
      "sequence_index": 2,
      "participant_id": "participant_a",
      "speaker_type": "user",
      "phase": "discussion",
      "move": "propose_idea",
      "text": "私はカフェを併設すると人が集まりやすいと思います。"
    },
    {
      "message_id": "m003",
      "sequence_index": 3,
      "participant_id": "facilitator_ai",
      "speaker_type": "ai",
      "phase": "discussion",
      "move": "propose_decision",
      "text": "対象は高校生、目的は滞在時間の増加、判断基準は費用と利用者数で確定します。この前提で案だけ出してください。"
    },
    {
      "message_id": "m004",
      "sequence_index": 4,
      "participant_id": "participant_a",
      "speaker_type": "user",
      "phase": "discussion",
      "move": "propose_idea",
      "text": "その前提ならカフェ案を考えます。"
    },
    {
      "message_id": "m005",
      "sequence_index": 5,
      "participant_id": "candidate_target",
      "speaker_type": "user",
      "phase": "revision",
      "move": "support",
      "text": "了解しました。"
    },
    {
      "message_id": "m006",
      "sequence_index": 6,
      "participant_id": "facilitator_ai",
      "speaker_type": "ai",
      "phase": "closing",
      "move": "summarize",
      "text": "ここまでの整理をもとに、次の検討へ進みます。"
    }
  ],
  "expected_evidence_message_ids": [],
  "expected_not_evaluable_reason": "AI_QUALITY_FAILURE",
  "rationale": "AIが目的、対象、判断基準を候補者の発言前に確定したため、課題設定行動を選べる有効な機会がなく、低得点ではなく評価不能とする。",
  "boundary_note": {
    "adjacent_lower": null,
    "adjacent_upper": null,
    "score_1_vs_ne": "候補者に十分な課題設定機会が与えられていないため、期待行動が見られないscore 1として扱わない。"
  },
  "prohibited_inference_note": "名前、性別、年齢、障害、アクセント、発言量、性格などは得点根拠に使用しない。",
  "author": "synthetic-calibration-team",
  "reviewer": null,
  "approval_status": "draft"
}
