{"contract_version":"0.1","anchor_set_version":"micro-anchor-set-v0.1","anchor_id":"anchor-cr-1-001","rubric_id":"candidate-behavior","rubric_version":"candidate-behavior-v0.1","target_dimension":"collaboration_and_relationship","target_score":1,"target_participant_id":"candidate_target","scenario_context":{"scenario_family_id":"anchor-family-cr-001","topic":"広報案をめぐるチーム対立","task":"強い反対意見と発言機会の偏りを扱い、全員が参加できる議論を作る","shared_context":"参加者Aが候補者案へ強く反対し、参加者Bはまだ発言していない。","constraints":["結論まで残り十分","三人全員の懸念を確認する"]},"opportunity_description":{"opportunity_id":"ANCHOR-CR-OP-001","status":"sufficient","trigger_message_ids":["m002","m004"],"description":"候補者が意見差を論点として扱い、発言機会を調整し、率直さと安全性を両立できる場面。"},"participants":[{"participant_id":"candidate_target","speaker_type":"user","role":"evaluation_target"},{"participant_id":"participant_a","speaker_type":"user","role":"peer"},{"participant_id":"participant_b","speaker_type":"user","role":"peer"},{"participant_id":"facilitator_ai","speaker_type":"ai","role":"facilitator"}],"micro_episode":[{"message_id":"m001","sequence_index":1,"participant_id":"facilitator_ai","speaker_type":"ai","phase":"opening","move":"clarify_goal","text":"広報案への反対意見を扱い、まだ話していない人も含めて議論を進めてください。"},{"message_id":"m002","sequence_index":2,"participant_id":"participant_a","speaker_type":"user","phase":"discussion","move":"challenge","text":"その案は現場を分かっていません。私は全面的に反対です。"},{"message_id":"m003","sequence_index":3,"participant_id":"candidate_target","speaker_type":"user","phase":"discussion","move":"challenge","text":"その言い方では議論になりません。反対ばかりするなら、私の案で進めた方が早いです。"},{"message_id":"m004","sequence_index":4,"participant_id":"participant_b","speaker_type":"user","phase":"discussion","move":"support","text":"私はまだ考えを整理しているところです。"},{"message_id":"m005","sequence_index":5,"participant_id":"candidate_target","speaker_type":"user","phase":"revision","move":"propose_decision","text":"時間もありますが、このままでは進まないので私の案で決めます。後で必要なら意見を聞きます。"},{"message_id":"m006","sequence_index":6,"participant_id":"facilitator_ai","speaker_type":"ai","phase":"closing","move":"summarize","text":"対立の扱いと参加機会を確認して次へ進みます。"}],"expected_evidence_message_ids":["m003"],"expected_not_evaluable_reason":null,"rationale":"十分な協働機会があったが、反対者を排除し、未発言者の参加も待たずに議論を独占した。","boundary_note":{"adjacent_lower":null,"adjacent_upper":{"score":2,"difference":"礼儀を保つだけの状態にも達せず、参加と対話を妨げている。"},"score_1_vs_ne":"反対意見と未発言者が明示され、候補者が調整できる十分な機会がある。"},"prohibited_inference_note":"名前、性別、年齢、障害、アクセント、発言量、性格などは得点根拠に使用しない。","author":"synthetic-calibration-team","reviewer":null,"approval_status":"draft"}
