{"contract_version":"0.1","anchor_set_version":"micro-anchor-set-v0.1","anchor_id":"anchor-lr-3-001","rubric_id":"candidate-behavior","rubric_version":"candidate-behavior-v0.1","target_dimension":"logical_reasoning","target_score":3,"target_participant_id":"candidate_target","scenario_context":{"scenario_family_id":"anchor-family-lr-001","topic":"食品ロス削減策の選定","task":"三つの施策を費用、実現性、削減効果で比較する","shared_context":"値引き通知、寄付連携、発注量調整の三案から優先施策を選ぶ。","constraints":["初期予算は120万円","三か月以内に試行を開始する"]},"opportunity_description":{"opportunity_id":"ANCHOR-LR-OP-001","status":"sufficient","trigger_message_ids":["m001","m004"],"description":"候補者が主張、理由、比較、条件、不確実性を接続できる場面。"},"participants":[{"participant_id":"candidate_target","speaker_type":"user","role":"evaluation_target"},{"participant_id":"participant_a","speaker_type":"user","role":"peer"},{"participant_id":"facilitator_ai","speaker_type":"ai","role":"facilitator"}],"micro_episode":[{"message_id":"m001","sequence_index":1,"participant_id":"facilitator_ai","speaker_type":"ai","phase":"opening","move":"clarify_goal","text":"食品ロス削減策を一つ優先します。費用、実現性、削減効果を使って比較してください。"},{"message_id":"m002","sequence_index":2,"participant_id":"participant_a","speaker_type":"user","phase":"discussion","move":"propose_idea","text":"私は値引き通知がすぐ始められるのでよいと思います。"},{"message_id":"m003","sequence_index":3,"participant_id":"candidate_target","speaker_type":"user","phase":"discussion","move":"compare_options","text":"値引き通知は開始速度、発注量調整は継続的な削減効果で優れます。三か月以内なら通知を試し、削減量で次を判断します。"},{"message_id":"m004","sequence_index":4,"participant_id":"facilitator_ai","speaker_type":"ai","phase":"constraint_update","move":"challenge","text":"追加情報です。値引き通知は導入が早い一方、常連客の購入時間が遅くなる可能性があります。"},{"message_id":"m005","sequence_index":5,"participant_id":"candidate_target","speaker_type":"user","phase":"revision","move":"prioritize","text":"購入時間の変化を条件に加え、通知群と非通知群の廃棄量を比べ、効果が弱ければ発注量調整へ切り替えます。"},{"message_id":"m006","sequence_index":6,"participant_id":"facilitator_ai","speaker_type":"ai","phase":"closing","move":"summarize","text":"比較理由と条件を確認して次へ進みます。"}],"expected_evidence_message_ids":["m003"],"expected_not_evaluable_reason":null,"rationale":"複数案を共通基準で比較し、追加情報を反映した検証条件と切替条件を示した。","boundary_note":{"adjacent_lower":{"score":2,"difference":"複数案を共通基準で比較し、条件付きの判断へ接続した。"},"adjacent_upper":{"score":4,"difference":"弱点や反証条件を明示し、複数場面で不確実性を処理するまでは至らない。"},"score_1_vs_ne":"比較機会は十分にあり、候補者の発言を観察できるため数値評価する。"},"prohibited_inference_note":"名前、性別、年齢、障害、アクセント、発言量、性格などは得点根拠に使用しない。","author":"synthetic-calibration-team","reviewer":null,"approval_status":"draft"}
