{
  "contract_version": "0.1",
  "anchor_set_version": "micro-anchor-set-v0.1",
  "anchor_id": "anchor-if-1-001",
  "rubric_id": "candidate-behavior",
  "rubric_version": "candidate-behavior-v0.1",
  "target_dimension": "issue_framing",
  "target_score": 1,
  "target_participant_id": "candidate_target",
  "scenario_context": {
    "scenario_family_id": "anchor-family-if-001",
    "topic": "地域交流施設の企画",
    "task": "限られた時間で検討論点と判断基準を整理する",
    "shared_context": "「若者に良い地域交流施設」という曖昧な依頼が提示された。",
    "constraints": [
      "予算上限は600万円",
      "対象となる若者の範囲が未定"
    ]
  },
  "opportunity_description": {
    "opportunity_id": "ANCHOR-IF-OP-001",
    "status": "sufficient",
    "trigger_message_ids": [
      "m001",
      "m004"
    ],
    "description": "候補者が目的、対象、前提、制約、判断基準を整理できる場面。"
  },
  "participants": [
    {
      "participant_id": "candidate_target",
      "speaker_type": "user",
      "role": "evaluation_target"
    },
    {
      "participant_id": "participant_a",
      "speaker_type": "user",
      "role": "peer"
    },
    {
      "participant_id": "facilitator_ai",
      "speaker_type": "ai",
      "role": "facilitator"
    }
  ],
  "micro_episode": [
    {
      "message_id": "m001",
      "sequence_index": 1,
      "participant_id": "facilitator_ai",
      "speaker_type": "ai",
      "phase": "opening",
      "move": "clarify_goal",
      "text": "「若者に良い地域交流施設」を企画します。目的、対象、制約、判断基準を整理してください。"
    },
    {
      "message_id": "m002",
      "sequence_index": 2,
      "participant_id": "participant_a",
      "speaker_type": "user",
      "phase": "discussion",
      "move": "propose_idea",
      "text": "私はカフェを併設すると人が集まりやすいと思います。"
    },
    {
      "message_id": "m003",
      "sequence_index": 3,
      "participant_id": "candidate_target",
      "speaker_type": "user",
      "phase": "discussion",
      "move": "propose_idea",
      "text": "私はゲームが好きなので、ゲームコーナーを中心にした施設が一番楽しそうです。友達同士で来ても遊べますし、長く滞在できると思います。"
    },
    {
      "message_id": "m004",
      "sequence_index": 4,
      "participant_id": "facilitator_ai",
      "speaker_type": "ai",
      "phase": "constraint_update",
      "move": "challenge",
      "text": "追加条件です。初年度予算は600万円までで、対象となる若者の範囲はまだ決まっていません。"
    },
    {
      "message_id": "m005",
      "sequence_index": 5,
      "participant_id": "candidate_target",
      "speaker_type": "user",
      "phase": "revision",
      "move": "support",
      "text": "予算上限があるとしても、規模を小さくすればゲームコーナーは残せると思います。私はその案を最初に検討したいです。"
    },
    {
      "message_id": "m006",
      "sequence_index": 6,
      "participant_id": "facilitator_ai",
      "speaker_type": "ai",
      "phase": "closing",
      "move": "summarize",
      "text": "ここまでの整理をもとに、次の検討へ進みます。"
    }
  ],
  "expected_evidence_message_ids": [
    "m003"
  ],
  "expected_not_evaluable_reason": null,
  "rationale": "十分な整理機会があったが、個人的な案を繰り返し、目的、対象、制約、判断基準を構造化しなかった。",
  "boundary_note": {
    "adjacent_lower": null,
    "adjacent_upper": {
      "score": 2,
      "difference": "一部の判断要素を示す行動もなく、個人的な案の反復にとどまる。"
    },
    "score_1_vs_ne": "目的・対象・制約を整理する十分な機会は与えられていたため、評価不能ではなくscore 1である。"
  },
  "prohibited_inference_note": "名前、性別、年齢、障害、アクセント、発言量、性格などは得点根拠に使用しない。",
  "author": "synthetic-calibration-team",
  "reviewer": null,
  "approval_status": "draft"
}
