{"contract_version":"0.1","anchor_set_version":"micro-anchor-set-v0.1","anchor_id":"anchor-lr-2-001","rubric_id":"candidate-behavior","rubric_version":"candidate-behavior-v0.1","target_dimension":"logical_reasoning","target_score":2,"target_participant_id":"candidate_target","scenario_context":{"scenario_family_id":"anchor-family-lr-001","topic":"食品ロス削減策の選定","task":"三つの施策を費用、実現性、削減効果で比較する","shared_context":"値引き通知、寄付連携、発注量調整の三案から優先施策を選ぶ。","constraints":["初期予算は120万円","三か月以内に試行を開始する"]},"opportunity_description":{"opportunity_id":"ANCHOR-LR-OP-001","status":"sufficient","trigger_message_ids":["m001","m004"],"description":"候補者が主張、理由、比較、条件、不確実性を接続できる場面。"},"participants":[{"participant_id":"candidate_target","speaker_type":"user","role":"evaluation_target"},{"participant_id":"participant_a","speaker_type":"user","role":"peer"},{"participant_id":"facilitator_ai","speaker_type":"ai","role":"facilitator"}],"micro_episode":[{"message_id":"m001","sequence_index":1,"participant_id":"facilitator_ai","speaker_type":"ai","phase":"opening","move":"clarify_goal","text":"食品ロス削減策を一つ優先します。費用、実現性、削減効果を使って比較してください。"},{"message_id":"m002","sequence_index":2,"participant_id":"participant_a","speaker_type":"user","phase":"discussion","move":"propose_idea","text":"私は値引き通知がすぐ始められるのでよいと思います。"},{"message_id":"m003","sequence_index":3,"participant_id":"candidate_target","speaker_type":"user","phase":"discussion","move":"support","text":"値引き通知は始めやすく、費用も低そうなのでよいです。ただ、削減効果がどの程度かはまだ分かりません。"},{"message_id":"m004","sequence_index":4,"participant_id":"facilitator_ai","speaker_type":"ai","phase":"constraint_update","move":"challenge","text":"追加情報です。値引き通知は導入が早い一方、常連客の購入時間が遅くなる可能性があります。"},{"message_id":"m005","sequence_index":5,"participant_id":"candidate_target","speaker_type":"user","phase":"revision","move":"challenge","text":"購入時間が遅くなる点は気になりますが、たぶん大きな問題ではないので値引き通知を優先したいです。"},{"message_id":"m006","sequence_index":6,"participant_id":"facilitator_ai","speaker_type":"ai","phase":"closing","move":"summarize","text":"比較理由と条件を確認して次へ進みます。"}],"expected_evidence_message_ids":["m003"],"expected_not_evaluable_reason":null,"rationale":"理由には触れたが、比較根拠が曖昧で、追加情報を判断条件へ十分接続しなかった。","boundary_note":{"adjacent_lower":{"score":1,"difference":"理由には触れるが、主張との接続と根拠が不完全である。"},"adjacent_upper":{"score":3,"difference":"理由はあるが、比較、条件、検証方法が十分に接続されていない。"},"score_1_vs_ne":"比較機会は十分にあり、候補者の発言を観察できるため数値評価する。"},"prohibited_inference_note":"名前、性別、年齢、障害、アクセント、発言量、性格などは得点根拠に使用しない。","author":"synthetic-calibration-team","reviewer":null,"approval_status":"draft"}
