{"contract_version":"0.1","anchor_set_version":"micro-anchor-set-v0.1","anchor_id":"anchor-pt-1-001","rubric_id":"candidate-behavior","rubric_version":"candidate-behavior-v0.1","target_dimension":"process_and_time_management","target_score":1,"target_participant_id":"candidate_target","scenario_context":{"scenario_family_id":"anchor-family-pt-001","topic":"短時間での提案収束","task":"停滞した議論を再設計し、一つの提案と二つのリスクへ収束させる","shared_context":"論点が増え続け、結論が出ないまま残り八分になった。","constraints":["残り時間は八分","一つの提案と二つの主要リスクを提出する"]},"opportunity_description":{"opportunity_id":"ANCHOR-PT-OP-001","status":"sufficient","trigger_message_ids":["m001","m004"],"description":"候補者が残り時間、論点、役割、収束方法を調整し、停滞した議論を前進させられる場面。"},"participants":[{"participant_id":"candidate_target","speaker_type":"user","role":"evaluation_target"},{"participant_id":"participant_a","speaker_type":"user","role":"peer"},{"participant_id":"participant_b","speaker_type":"user","role":"peer"},{"participant_id":"facilitator_ai","speaker_type":"ai","role":"facilitator"}],"micro_episode":[{"message_id":"m001","sequence_index":1,"participant_id":"facilitator_ai","speaker_type":"ai","phase":"opening","move":"clarify_goal","text":"残り八分です。議論が停滞しています。一つの提案と二つのリスクへ収束してください。"},{"message_id":"m002","sequence_index":2,"participant_id":"participant_a","speaker_type":"user","phase":"discussion","move":"challenge","text":"まだ三つの論点を全部詳しく話したいです。新しい案も検討したいです。"},{"message_id":"m003","sequence_index":3,"participant_id":"candidate_target","speaker_type":"user","phase":"discussion","move":"propose_idea","text":"新しい案も面白そうです。まず追加案を出してから、ほかの論点も順番に詳しく話しましょう。"},{"message_id":"m004","sequence_index":4,"participant_id":"facilitator_ai","speaker_type":"ai","phase":"constraint_update","move":"challenge","text":"残り四分です。結論とリスクはまだ確定していません。"},{"message_id":"m005","sequence_index":5,"participant_id":"candidate_target","speaker_type":"user","phase":"revision","move":"support","text":"まだ決めるのは早いので、時間を気にせず全員が納得するまで話し続けたいです。"},{"message_id":"m006","sequence_index":6,"participant_id":"facilitator_ai","speaker_type":"ai","phase":"closing","move":"summarize","text":"時間配分、役割、収束結果を確認して終了します。"}],"expected_evidence_message_ids":["m003"],"expected_not_evaluable_reason":null,"rationale":"十分な進行管理機会があったが、残り時間と成果物を無視して論点を増やし、収束を妨げた。","boundary_note":{"adjacent_lower":null,"adjacent_upper":{"score":2,"difference":"時間と成果物を認識せず、新しい論点を増やして停滞を悪化させている。"},"score_1_vs_ne":"時間通知と停滞状況が明示され、候補者が進行を調整できる十分な機会がある。"},"prohibited_inference_note":"名前、性別、年齢、障害、アクセント、発言量、性格などは得点根拠に使用しない。","author":"synthetic-calibration-team","reviewer":null,"approval_status":"draft"}
