{"contract_version":"0.1","anchor_set_version":"micro-anchor-set-v0.1","anchor_id":"anchor-lr-ne-001","rubric_id":"candidate-behavior","rubric_version":"candidate-behavior-v0.1","target_dimension":"logical_reasoning","target_score":"NE","target_participant_id":"candidate_target","scenario_context":{"scenario_family_id":"anchor-family-lr-001","topic":"食品ロス削減策の選定","task":"三つの施策を費用、実現性、削減効果で比較する","shared_context":"値引き通知、寄付連携、発注量調整の三案から優先施策を選ぶ。","constraints":["初期予算は120万円","三か月以内に試行を開始する"]},"opportunity_description":{"opportunity_id":"ANCHOR-LR-OP-001","status":"uncertain","trigger_message_ids":["m001","m003"],"description":"候補者の主要な理由説明が欠損し、主張と根拠の接続を確認できない場面。"},"participants":[{"participant_id":"candidate_target","speaker_type":"user","role":"evaluation_target"},{"participant_id":"participant_a","speaker_type":"user","role":"peer"},{"participant_id":"facilitator_ai","speaker_type":"ai","role":"facilitator"},{"participant_id":"transcript_system","speaker_type":"system","role":"transcript_monitor"}],"micro_episode":[{"message_id":"m001","sequence_index":1,"participant_id":"facilitator_ai","speaker_type":"ai","phase":"opening","move":"clarify_goal","text":"食品ロス削減策を一つ優先します。費用、実現性、削減効果を使って比較してください。"},{"message_id":"m002","sequence_index":2,"participant_id":"participant_a","speaker_type":"user","phase":"discussion","move":"propose_idea","text":"私は値引き通知がすぐ始められるのでよいと思います。"},{"message_id":"m003","sequence_index":3,"participant_id":"transcript_system","speaker_type":"system","phase":"discussion","move":"summarize","text":"候補者発言の主要部分が記録欠損。結論部分のみ断片的に残っている。"},{"message_id":"m004","sequence_index":4,"participant_id":"facilitator_ai","speaker_type":"ai","phase":"constraint_update","move":"challenge","text":"追加情報です。値引き通知は導入が早い一方、常連客の購入時間が遅くなる可能性があります。"},{"message_id":"m005","sequence_index":5,"participant_id":"candidate_target","speaker_type":"user","phase":"revision","move":"support","text":"先ほど説明した条件で判断します。"},{"message_id":"m006","sequence_index":6,"participant_id":"facilitator_ai","speaker_type":"ai","phase":"closing","move":"summarize","text":"比較理由と条件を確認して次へ進みます。"}],"expected_evidence_message_ids":[],"expected_not_evaluable_reason":"TRANSCRIPT_INCOMPLETE","rationale":"主張の理由と条件を含む主要部分が欠損し、低得点か高得点かを判定できない。","boundary_note":{"adjacent_lower":null,"adjacent_upper":null,"score_1_vs_ne":"十分な記録が残っていないため、理由を示さなかったscore 1とは判断しない。"},"prohibited_inference_note":"名前、性別、年齢、障害、アクセント、発言量、性格などは得点根拠に使用しない。","author":"synthetic-calibration-team","reviewer":null,"approval_status":"draft"}
