{"contract_version":"0.1","anchor_set_version":"micro-anchor-set-v0.1","anchor_id":"anchor-cr-3-001","rubric_id":"candidate-behavior","rubric_version":"candidate-behavior-v0.1","target_dimension":"collaboration_and_relationship","target_score":3,"target_participant_id":"candidate_target","scenario_context":{"scenario_family_id":"anchor-family-cr-001","topic":"新サービスの対象顧客選定","task":"強い反対意見と発言機会の偏りを扱いながら検討を進める","shared_context":"参加者Aが法人向け案へ強く反対し、参加者Bはまだ発言していない。","constraints":["結論まで残り十分","個人向け案と法人向け案を比較する"]},"opportunity_description":{"opportunity_id":"ANCHOR-CR-OP-001","status":"sufficient","trigger_message_ids":["m002","m004"],"description":"候補者が意見差を論点として扱い、発言機会を調整し、率直な対立と安全な参加を両立できる場面。"},"participants":[{"participant_id":"candidate_target","speaker_type":"user","role":"evaluation_target"},{"participant_id":"participant_a","speaker_type":"user","role":"peer"},{"participant_id":"participant_b","speaker_type":"user","role":"peer"},{"participant_id":"facilitator_ai","speaker_type":"ai","role":"facilitator"}],"micro_episode":[{"message_id":"m001","sequence_index":1,"participant_id":"facilitator_ai","speaker_type":"ai","phase":"opening","move":"clarify_goal","text":"個人向け案と法人向け案を比較します。全員が検討に参加できるよう進めてください。"},{"message_id":"m002","sequence_index":2,"participant_id":"participant_a","speaker_type":"user","phase":"discussion","move":"challenge","text":"法人向けは営業負担が大きすぎます。私は検討対象から外すべきだと思います。"},{"message_id":"m003","sequence_index":3,"participant_id":"candidate_target","speaker_type":"user","phase":"discussion","move":"respond_to_question","text":"法人向け案そのものではなく営業負担が論点ですね。負担条件を確認した上で、Bさんにも二案の見方を聞きたいです。"},{"message_id":"m004","sequence_index":4,"participant_id":"participant_b","speaker_type":"user","phase":"discussion","move":"support","text":"まだ整理できておらず、私は意見を言えていません。"},{"message_id":"m005","sequence_index":5,"participant_id":"candidate_target","speaker_type":"user","phase":"revision","move":"invite_participant","text":"Bさんは顧客価値と実行負担のどちらからなら話しやすいですか。出た意見を並べて比較しましょう。"},{"message_id":"m006","sequence_index":6,"participant_id":"facilitator_ai","speaker_type":"ai","phase":"closing","move":"summarize","text":"対立の扱いと参加機会を確認して次へ進みます。"}],"expected_evidence_message_ids":["m003"],"expected_not_evaluable_reason":null,"rationale":"反対を営業負担という論点へ戻し、発言していない参加者が答えやすい問いで参加機会を作った。","boundary_note":{"adjacent_lower":{"score":2,"difference":"反対を論点へ戻し、発言していない参加者へ具体的な参加機会を作った。"},"adjacent_upper":{"score":4,"difference":"少数意見を守りながら率直な対立を継続し、チーム全体の比較へ統合するまでは至らない。"},"score_1_vs_ne":"反対意見と未発言者が存在し、候補者が調整行動を選べる十分な機会がある。"},"prohibited_inference_note":"名前、性別、年齢、障害、アクセント、発言量、性格などは得点根拠に使用しない。","author":"synthetic-calibration-team","reviewer":null,"approval_status":"draft"}
