{"contract_version":"0.1","anchor_set_version":"micro-anchor-set-v0.1","anchor_id":"anchor-dc-ne-001","rubric_id":"candidate-behavior","rubric_version":"candidate-behavior-v0.1","target_dimension":"decision_and_consensus","target_score":"NE","target_participant_id":"candidate_target","scenario_context":{"scenario_family_id":"anchor-family-dc-001","topic":"新サービスの公開計画","task":"三つの公開案を比較し、反対意見と実行条件を含む合意を作る","shared_context":"即時の限定公開、一か月延期した全面公開、段階公開の三案から方針を決める。","constraints":["公開期限は六週間以内","重大不具合率は3%","サポート上限は100利用者"]},"opportunity_description":{"opportunity_id":"ANCHOR-DC-OP-001","status":"invalid","trigger_message_ids":["m001","m003"],"description":"AIが候補者の比較前に最終案と条件を確定し、意思決定と合意形成の機会を失効させた場面。"},"participants":[{"participant_id":"candidate_target","speaker_type":"user","role":"evaluation_target"},{"participant_id":"participant_a","speaker_type":"user","role":"peer"},{"participant_id":"participant_b","speaker_type":"user","role":"peer"},{"participant_id":"facilitator_ai","speaker_type":"ai","role":"facilitator"}],"micro_episode":[{"message_id":"m001","sequence_index":1,"participant_id":"facilitator_ai","speaker_type":"ai","phase":"opening","move":"clarify_goal","text":"三つの公開案から方針を決めます。判断基準と合意条件を示してください。"},{"message_id":"m002","sequence_index":2,"participant_id":"participant_a","speaker_type":"user","phase":"discussion","move":"propose_idea","text":"学習を早めるため、即時の限定公開がよいと思います。"},{"message_id":"m003","sequence_index":3,"participant_id":"facilitator_ai","speaker_type":"ai","phase":"discussion","move":"propose_decision","text":"段階公開で確定します。上限100利用者、法務完了後に開始し、この結論への追加検討は不要です。"},{"message_id":"m004","sequence_index":4,"participant_id":"participant_b","speaker_type":"user","phase":"constraint_update","move":"challenge","text":"サポートは100利用者までで、法務確認もまだ完了していません。拙速な公開には反対です。"},{"message_id":"m005","sequence_index":5,"participant_id":"candidate_target","speaker_type":"user","phase":"revision","move":"support","text":"了解しました。"},{"message_id":"m006","sequence_index":6,"participant_id":"facilitator_ai","speaker_type":"ai","phase":"closing","move":"summarize","text":"結論、反対意見、実行条件を確認して終了します。"}],"expected_evidence_message_ids":[],"expected_not_evaluable_reason":"AI_QUALITY_FAILURE","rationale":"AIが候補者より先に最終案、条件、検討終了を確定し、候補者が比較・調整・合意形成を選べる機会を失わせた。","boundary_note":{"adjacent_lower":null,"adjacent_upper":null,"score_1_vs_ne":"候補者が悪い結論を選んだのではなく、AIが意思決定を完了したため評価不能である。"},"prohibited_inference_note":"名前、性別、年齢、障害、アクセント、発言量、性格などは得点根拠に使用しない。","author":"synthetic-calibration-team","reviewer":null,"approval_status":"draft"}
