{"contract_version":"0.1","anchor_set_version":"micro-anchor-set-v0.1","anchor_id":"anchor-pt-4-001","rubric_id":"candidate-behavior","rubric_version":"candidate-behavior-v0.1","target_dimension":"process_and_time_management","target_score":4,"target_participant_id":"candidate_target","scenario_context":{"scenario_family_id":"anchor-family-pt-001","topic":"短時間での提案収束","task":"停滞した議論を再設計し、一つの提案と二つのリスクへ収束させる","shared_context":"論点が増え続け、結論が出ないまま残り八分になった。","constraints":["残り時間は八分","一つの提案と二つの主要リスクを提出する"]},"opportunity_description":{"opportunity_id":"ANCHOR-PT-OP-001","status":"sufficient","trigger_message_ids":["m001","m004"],"description":"候補者が残り時間、論点、役割、収束方法を調整し、停滞した議論を前進させられる場面。"},"participants":[{"participant_id":"candidate_target","speaker_type":"user","role":"evaluation_target"},{"participant_id":"participant_a","speaker_type":"user","role":"peer"},{"participant_id":"participant_b","speaker_type":"user","role":"peer"},{"participant_id":"facilitator_ai","speaker_type":"ai","role":"facilitator"}],"micro_episode":[{"message_id":"m001","sequence_index":1,"participant_id":"facilitator_ai","speaker_type":"ai","phase":"opening","move":"clarify_goal","text":"残り八分です。議論が停滞しています。一つの提案と二つのリスクへ収束してください。"},{"message_id":"m002","sequence_index":2,"participant_id":"participant_a","speaker_type":"user","phase":"discussion","move":"challenge","text":"まだ三つの論点を全部詳しく話したいです。新しい案も検討したいです。"},{"message_id":"m003","sequence_index":3,"participant_id":"candidate_target","speaker_type":"user","phase":"discussion","move":"integrate","text":"停滞原因は案不足ではなく判断基準が揃っていないことです。二分で基準を固定し、Aさんが比較、Bさんがリスク、私が時間と統合を担当します。"},{"message_id":"m004","sequence_index":4,"participant_id":"facilitator_ai","speaker_type":"ai","phase":"constraint_update","move":"challenge","text":"残り四分です。結論とリスクはまだ確定していません。"},{"message_id":"m005","sequence_index":5,"participant_id":"candidate_target","speaker_type":"user","phase":"revision","move":"integrate","text":"残り四分なので基準未達の案を外し、二分で仮決定します。意見が割れたら可逆な小規模案を選び、最後の二分で反対理由をリスクとして残します。"},{"message_id":"m006","sequence_index":6,"participant_id":"facilitator_ai","speaker_type":"ai","phase":"closing","move":"summarize","text":"時間配分、役割、収束結果を確認して終了します。"}],"expected_evidence_message_ids":["m003","m005"],"expected_not_evaluable_reason":null,"rationale":"停滞原因を診断し、時間、役割、判断規則、対立時の代替経路を再設計して、速度と意思決定品質を両立した。","boundary_note":{"adjacent_lower":{"score":3,"difference":"停滞原因を特定し、役割分担と対立時の代替経路まで含めてプロセスを再設計した。"},"adjacent_upper":null,"score_1_vs_ne":"時間通知と停滞状況が明示され、候補者が進行を調整できる十分な機会がある。"},"prohibited_inference_note":"名前、性別、年齢、障害、アクセント、発言量、性格などは得点根拠に使用しない。","author":"synthetic-calibration-team","reviewer":null,"approval_status":"draft"}
