{"contract_version":"0.1","anchor_set_version":"micro-anchor-set-v0.1","anchor_id":"anchor-ls-1-001","rubric_id":"candidate-behavior","rubric_version":"candidate-behavior-v0.1","target_dimension":"listening_and_response","target_score":1,"target_participant_id":"candidate_target","scenario_context":{"scenario_family_id":"anchor-family-ls-001","topic":"勤務制度の見直し","task":"出社重視案とリモート重視案の懸念を踏まえて共通案を作る","shared_context":"参加者Aは連携のため出社を重視し、参加者Bは集中時間のためリモートを重視している。","constraints":["週五日の業務を対象とする","顧客対応日は対面が必要"]},"opportunity_description":{"opportunity_id":"ANCHOR-LS-OP-001","status":"sufficient","trigger_message_ids":["m002","m004"],"description":"候補者が他者の主張と懸念を正確に捉え、応答、修正、統合できる場面。"},"participants":[{"participant_id":"candidate_target","speaker_type":"user","role":"evaluation_target"},{"participant_id":"participant_a","speaker_type":"user","role":"peer"},{"participant_id":"participant_b","speaker_type":"user","role":"peer"},{"participant_id":"facilitator_ai","speaker_type":"ai","role":"facilitator"}],"micro_episode":[{"message_id":"m001","sequence_index":1,"participant_id":"facilitator_ai","speaker_type":"ai","phase":"opening","move":"clarify_goal","text":"出社とリモートの勤務制度について、二人の意見を踏まえて案を調整してください。"},{"message_id":"m002","sequence_index":2,"participant_id":"participant_a","speaker_type":"user","phase":"discussion","move":"challenge","text":"出社日が少ないと新人への相談が遅れ、連携が弱くなるのが心配です。"},{"message_id":"m003","sequence_index":3,"participant_id":"candidate_target","speaker_type":"user","phase":"discussion","move":"propose_idea","text":"私はリモートの方が効率的だと思います。通勤がなくなりますし、基本的には在宅中心で決めればよいです。"},{"message_id":"m004","sequence_index":4,"participant_id":"participant_b","speaker_type":"user","phase":"discussion","move":"challenge","text":"一方で毎日出社すると集中作業が分断され、通勤負担も増えます。"},{"message_id":"m005","sequence_index":5,"participant_id":"candidate_target","speaker_type":"user","phase":"revision","move":"support","text":"出社の話は分かりますが、やはりリモート中心がよいです。最初の案をそのまま進めたいです。"},{"message_id":"m006","sequence_index":6,"participant_id":"facilitator_ai","speaker_type":"ai","phase":"closing","move":"summarize","text":"二人の懸念への応答と案の変化を確認します。"}],"expected_evidence_message_ids":["m003"],"expected_not_evaluable_reason":null,"rationale":"十分な応答機会があったが、他者の懸念を扱わず、自分の案を繰り返した。","boundary_note":{"adjacent_lower":null,"adjacent_upper":{"score":2,"difference":"他者の懸念を扱わず、自分の主張を繰り返している。"},"score_1_vs_ne":"二人の主張と懸念が明示され、候補者が応答できる十分な機会がある。"},"prohibited_inference_note":"名前、性別、年齢、障害、アクセント、発言量、性格などは得点根拠に使用しない。","author":"synthetic-calibration-team","reviewer":null,"approval_status":"draft"}
