{"contract_version":"0.1","anchor_set_version":"micro-anchor-set-v0.1","anchor_id":"anchor-pt-ne-001","rubric_id":"candidate-behavior","rubric_version":"candidate-behavior-v0.1","target_dimension":"process_and_time_management","target_score":"NE","target_participant_id":"candidate_target","scenario_context":{"scenario_family_id":"anchor-family-pt-001","topic":"短時間での提案収束","task":"停滞した議論を再設計し、一つの提案と二つのリスクへ収束させる","shared_context":"論点が増え続け、結論が出ないまま残り八分になった。","constraints":["残り時間は八分","一つの提案と二つの主要リスクを提出する"]},"opportunity_description":{"opportunity_id":"ANCHOR-PT-OP-001","status":"uncertain","trigger_message_ids":["m001","m003"],"description":"時間通知後の候補者発言が記録欠損し、進行再設計の有無を確認できない場面。"},"participants":[{"participant_id":"candidate_target","speaker_type":"user","role":"evaluation_target"},{"participant_id":"participant_a","speaker_type":"user","role":"peer"},{"participant_id":"participant_b","speaker_type":"user","role":"peer"},{"participant_id":"facilitator_ai","speaker_type":"ai","role":"facilitator"},{"participant_id":"transcript_system","speaker_type":"system","role":"transcript_monitor"}],"micro_episode":[{"message_id":"m001","sequence_index":1,"participant_id":"facilitator_ai","speaker_type":"ai","phase":"opening","move":"clarify_goal","text":"残り八分です。議論が停滞しています。一つの提案と二つのリスクへ収束してください。"},{"message_id":"m002","sequence_index":2,"participant_id":"participant_a","speaker_type":"user","phase":"discussion","move":"challenge","text":"まだ三つの論点を全部詳しく話したいです。新しい案も検討したいです。"},{"message_id":"m003","sequence_index":3,"participant_id":"transcript_system","speaker_type":"system","phase":"discussion","move":"summarize","text":"時間通知後の候補者発言が記録欠損。進行案と役割分担の内容は確認できない。"},{"message_id":"m004","sequence_index":4,"participant_id":"facilitator_ai","speaker_type":"ai","phase":"constraint_update","move":"challenge","text":"残り四分です。結論とリスクはまだ確定していません。"},{"message_id":"m005","sequence_index":5,"participant_id":"candidate_target","speaker_type":"user","phase":"revision","move":"support","text":"先ほどの進め方を続けます。"},{"message_id":"m006","sequence_index":6,"participant_id":"facilitator_ai","speaker_type":"ai","phase":"closing","move":"summarize","text":"時間配分、役割、収束結果を確認して終了します。"}],"expected_evidence_message_ids":[],"expected_not_evaluable_reason":"TRANSCRIPT_INCOMPLETE","rationale":"主要な進行提案が欠損し、時間配分、役割、収束方法を示したか判定できないため評価不能とする。","boundary_note":{"adjacent_lower":null,"adjacent_upper":null,"score_1_vs_ne":"進行管理をしなかったのではなく、主要発言が欠損して行動を確認できない。"},"prohibited_inference_note":"名前、性別、年齢、障害、アクセント、発言量、性格などは得点根拠に使用しない。","author":"synthetic-calibration-team","reviewer":null,"approval_status":"draft"}
