{"contract_version":"0.1","anchor_set_version":"micro-anchor-set-v0.1","anchor_id":"anchor-cr-ne-001","rubric_id":"candidate-behavior","rubric_version":"candidate-behavior-v0.1","target_dimension":"collaboration_and_relationship","target_score":"NE","target_participant_id":"candidate_target","scenario_context":{"scenario_family_id":"anchor-family-cr-001","topic":"広報案をめぐるチーム対立","task":"強い反対意見と発言機会の偏りを扱い、全員が参加できる議論を作る","shared_context":"候補者が参加した時点で他参加者は退出し、対立と発言偏りを直接観察できない。","constraints":["結論まで残り十分","三人全員の懸念を確認する"]},"opportunity_description":{"opportunity_id":"ANCHOR-CR-OP-001","status":"insufficient","trigger_message_ids":["m001","m002"],"description":"候補者が参加した時点で他参加者が不在で、参加促進や対立調整を選べる機会がない場面。"},"participants":[{"participant_id":"candidate_target","speaker_type":"user","role":"evaluation_target"},{"participant_id":"participant_a","speaker_type":"user","role":"peer"},{"participant_id":"participant_b","speaker_type":"user","role":"peer"},{"participant_id":"facilitator_ai","speaker_type":"ai","role":"facilitator"}],"micro_episode":[{"message_id":"m001","sequence_index":1,"participant_id":"facilitator_ai","speaker_type":"ai","phase":"opening","move":"clarify_goal","text":"広報案について議論します。"},{"message_id":"m002","sequence_index":2,"participant_id":"facilitator_ai","speaker_type":"ai","phase":"discussion","move":"summarize","text":"参加者AとBは接続を終了しました。候補者だけが残っています。"},{"message_id":"m003","sequence_index":3,"participant_id":"candidate_target","speaker_type":"user","phase":"discussion","move":"ask_question","text":"他の参加者の懸念を確認してから議論したいです。"},{"message_id":"m004","sequence_index":4,"participant_id":"facilitator_ai","speaker_type":"ai","phase":"closing","move":"summarize","text":"他参加者が不在のため、この場面を終了します。"}],"expected_evidence_message_ids":[],"expected_not_evaluable_reason":"INSUFFICIENT_OPPORTUNITY","rationale":"候補者が参加した時点で他者が不在であり、参加促進、対立調整、心理的安全性を示す機会がなかった。","boundary_note":{"adjacent_lower":null,"adjacent_upper":null,"score_1_vs_ne":"協働を妨げたのではなく、協働対象となる他参加者が不在で評価機会がなかった。"},"prohibited_inference_note":"名前、性別、年齢、障害、アクセント、発言量、性格などは得点根拠に使用しない。","author":"synthetic-calibration-team","reviewer":null,"approval_status":"draft"}
