{"contract_version":"0.1","anchor_set_version":"micro-anchor-set-v0.1","anchor_id":"anchor-vc-2-001","rubric_id":"candidate-behavior","rubric_version":"candidate-behavior-v0.1","target_dimension":"valuable_contribution","target_score":2,"target_participant_id":"candidate_target","scenario_context":{"scenario_family_id":"anchor-family-vc-001","topic":"地域イベントの参加者減少対策","task":"既出の広告強化案と料金値下げ案を改善する","shared_context":"広告強化と参加料金値下げはすでに提案されている。","constraints":["追加予算は50万円","次回開催まで二か月"]},"opportunity_description":{"opportunity_id":"ANCHOR-VC-OP-001","status":"sufficient","trigger_message_ids":["m001","m004"],"description":"候補者が新しい視点、具体案、既存案の改善、リスク補完を提供できる場面。"},"participants":[{"participant_id":"candidate_target","speaker_type":"user","role":"evaluation_target"},{"participant_id":"participant_a","speaker_type":"user","role":"peer"},{"participant_id":"facilitator_ai","speaker_type":"ai","role":"facilitator"}],"micro_episode":[{"message_id":"m001","sequence_index":1,"participant_id":"facilitator_ai","speaker_type":"ai","phase":"opening","move":"clarify_goal","text":"参加者減少への対策を考えます。広告強化と料金値下げ以外の改善も検討してください。"},{"message_id":"m002","sequence_index":2,"participant_id":"participant_a","speaker_type":"user","phase":"discussion","move":"propose_idea","text":"私はSNS広告を増やす案がよいと思います。"},{"message_id":"m003","sequence_index":3,"participant_id":"candidate_target","speaker_type":"user","phase":"discussion","move":"propose_idea","text":"SNS広告に加えて、参加料金を少し下げるのもよいと思います。二つを組み合わせれば参加しやすくなります。"},{"message_id":"m004","sequence_index":4,"participant_id":"facilitator_ai","speaker_type":"ai","phase":"constraint_update","move":"challenge","text":"追加条件です。予算は50万円で、次回開催まで二か月しかありません。"},{"message_id":"m005","sequence_index":5,"participant_id":"candidate_target","speaker_type":"user","phase":"revision","move":"prioritize","text":"予算内で広告を出し、値下げ幅を小さくすれば実施できると思います。まずこの二つを試したいです。"},{"message_id":"m006","sequence_index":6,"participant_id":"facilitator_ai","speaker_type":"ai","phase":"closing","move":"summarize","text":"新しい貢献と実行方法を確認して次へ進みます。"}],"expected_evidence_message_ids":["m003"],"expected_not_evaluable_reason":null,"rationale":"既出の広告と値下げを組み合わせたが、新しい視点や具体的な改善方法は限定的だった。","boundary_note":{"adjacent_lower":{"score":1,"difference":"既出案を関連付ける発言はあるが、新しい具体性や改善効果は限定的である。"},"adjacent_upper":{"score":3,"difference":"既出案の組合せにとどまり、新しい視点や実行方法が不足する。"},"score_1_vs_ne":"既出案と制約が明示され、新規貢献を選べる十分な機会がある。"},"prohibited_inference_note":"名前、性別、年齢、障害、アクセント、発言量、性格などは得点根拠に使用しない。","author":"synthetic-calibration-team","reviewer":null,"approval_status":"draft"}
